id,season,episode,scene,line_text,speaker,deleted
29335,5,22,9,"It's small, I know.",Dwight,False
29344,5,22,9,That was four years ago. Why don't you let it go?,Michael,False
29345,5,22,9,Michael.,Dwight,False
29366,5,22,15,"Nah, that's weird. You're gonna sit. [Dwight sits] Great. You know, Dwight, it has been quite a transition for all of us. Are you happy with the way things have been runnin' lately?",Charles,False
29367,5,22,15,Do you mean compared to the ways things ran with other bosses? Comparisons are hard.,Dwight,False
29372,5,22,15,And I wanna start givin' you more responsibility. What do you say you and I go out for a drink this week?,Charles,False
29373,5,22,15,Really?,Dwight,False
29378,5,22,16,Oh n- Is it Mose? Did you put the cover on that well?,Michael,False
29379,5,22,16,"No, Mose is fine. I roped it off. It's not about Mose. Listen, things are changing here, Michael, they're changing fast.",Dwight,False
29384,5,22,16,Crystal clear. So is this for a movie that you're writing?,Michael,False
29385,5,22,16,No.,Dwight,False
29388,5,22,16,"[Michael dismisses note, Ryan and Pam point to notepad] Dwight, are you talking about us?",Michael,False
29389,5,22,16,It is possible that I could be talking about us.,Dwight,False
29390,5,22,16,Someone could say that it is like the situation that we are in now?,Michael,False
29391,5,22,16,It is the situation that we are in now.,Dwight,False
29392,5,22,16,"So I would say that the old boss has always been good to Dwight, and he was there first, so he has dibs. You respect dibs, don't you?",Michael,False
29393,5,22,16,I'm not a barbarian.,Dwight,False
29394,5,22,16,Good. Will you meet me in 20 minutes at the spot?,Michael,False
29395,5,22,16,I will.,Dwight,False
29396,5,22,16,Dwight?,Michael,False
29397,5,22,16,Yes?,Dwight,False
29398,5,22,16,Is the cool new guy Charles?,Michael,False
29399,5,22,16,I've said too much.,Dwight,False
29410,5,22,18,"Hello, Dwight. What's with the shirt? Are you alright?",Michael,False
29411,5,22,18,"I'm sorry, Michael",Dwight,False
29457,5,22,24,"So, you think Michael's going after the whale, huh?",Stanley,False
29458,5,22,24,I have a long term relationship with Harper Collins publishers and Mr. Schofield. I'm not worried.,Dwight,False
29464,5,22,25,Wow. High score?,Michael,False
29465,5,22,26,"And no, I cannot lower my current prices. [phone rings] Hold on. Hello? Mr. Schofield, thank you so much for taking the time to talk. I wanted to discuss your contract with us- oh, you're considering him. I thought Michael Scott left the paper business after his nervous breakdown.",Dwight,False
29467,5,22,28,"Hello, Dwight, I've been expecting your call. What do you want?",Michael,False
29468,5,22,28,I would like to arrange a truce.,Dwight,False
29469,5,22,28,"So you heard Schofield is considering a switch, and you want mercy?",Michael,False
29470,5,22,28,Meet me in our spot in four minutes.,Dwight,False
29494,5,22,30,"[Michael, Ryan and Pam sitting at restaurant, phone rings] Oh. Dwight-elicious. Where you at?",Michael,False
29495,5,22,30,"Oh, hi, Michael. I'm so sorry I'm late. I got stuck in traffic.",Dwight,False
29498,5,22,30,What?,Michael,False
29499,5,22,30,"He's technically fine. I imagine the true horror will be when he wakes up in a zoo. [throws a fish into the vent at Michael's office] Hey, listen, will you do me a favor and order the meatball parm for me, with extra cheese?",Dwight,False
29510,5,22,31,"No, Dwight, we were robbed. How would you even know? You're still stuck in traffic. [Pam holds up sign saying 'Dwight did it!!'] You?",Michael,False
29511,5,22,31,Me.,Dwight,False
29512,5,22,31,What about our truce?,Michael,False
29513,5,22,31,I broke it.,Dwight,False
29514,5,22,31,On purpose?,Michael,False
29515,5,22,31,Yes.,Dwight,False
29516,5,22,31,Why?,Michael,False
29517,5,22,31,"You think this is some kind of game? No, this is a war, and I will not stop, I will not rest. You have no idea what kind of enemy you've created. You have unleashed the wolf!",Dwight,False
29524,5,22,34,"Dwight, do you mind if we talk?",Michael,False
29525,5,22,34,Sure. That'd be fine.,Dwight,False
29560,5,22,40,What is that thing that Dwight always says? Paper is the soil in which the seeds of business grow?,Michael,False
29561,5,22,40,It's not the soil! It's the manure! Paper is the manure! On-time delivery is the soil! Aah! [runs into office],Dwight,False
29717,5,23,17,"Okay.  Hey, Dwight.  Can I talk to you?",Charles,False
29718,5,23,17,Sure thing.,Dwight,False
29821,5,23,27,Are you kidding me?,Pam,False
29822,5,23,28,"Well, Jerry, the one who got away.  May I ask why you're leaving the Michael Scott Paper Company?  Really?  Please hold.  [gets up and runs to kitchen]  Charles.",Dwight,False
29825,5,23,28,What?  How'd you hear that?,Charles,False
29826,5,23,28,They've been calling all of their clients and begging them to pay more money.  That can only mean one thing.  They're desperate.  Which can only mean one thing.  They're total failures.,Dwight,False
29829,5,23,28,"No, I mean, great detective work.  'Cause this must be the first case you've ever cracked, right?",Jim,False
29830,5,23,28,"You don't crack a case.  That has pejorative connotation.  That's like calling a policeman a cop.  You solve a case, and yes, I've solved plenty.",Dwight,False
29832,5,23,28,What are your top five cases?,Jim,False
29833,5,23,28,I'm gonna answer Charles first.,Dwight,False
29838,5,23,28,Because you have embarrassed me for the last time today.  Got it?,Charles,False
29839,5,23,28,I'm not-- I'm not following you.,Dwight,False
29954,5,24,14,What are you still doing not at your desk?,Andy,False
29955,5,24,14,Did you even read the memo?,Dwight,False
29961,5,24,15,Can I address that?,Jim,False
29962,5,24,15,"No, you're too close.",Dwight,False
29973,5,24,15,Of course.  What is like a hostage?,Jim,False
29974,5,24,15,Excellent question.,Dwight,False
30014,5,24,20,Hey gang. Where you been?,Michael,False
30015,5,24,20,Lunch.,Dwight,False
30046,5,24,24,"I'm sorry you feel that way, Mr. Bart.  Is there anything I can do to make things better?",Ryan,False
30047,5,24,24,"Whoa, whoa, whoa, whoa, whoa, whoa.  Give me the phone.  Give me the phone.",Dwight,False
30064,5,24,24,Who let this boy on the phone?,Stanley,False
30065,5,24,24,Ah! Mr. Bart!  Ugh! [slams phone down[ I cannot believe you lost that account.  He was my client for ten years!,Dwight,False
30092,5,24,26,"Just do it, okay?",Michael,False
30093,5,24,26,I'll do--,Dwight,False
30096,5,24,26,Are you kidding me?,Michael,False
30097,5,24,26,Deceit does not come easy to me.,Dwight,False
30220,5,25,5,"Guys, I'm scared. I'm really scared. I think I'm growing into a giant. Because look at this normal sized coffee cup. Looks so tiny in my giant hand now. Anybody want to go to lunch with me later on?",Michael,False
30221,5,25,5,I do.,Dwight,False
30240,5,25,12,"Hi, guys. How you doing?",Erin,False
30241,5,25,12,"Erin, how many times do I have to tell you? It is not necessary for you to ask us how we are doing every time you interact with us.",Dwight,False
30244,5,25,12,"Did somebody here leave a map in the printer to Youngstown, Ohio?",Erin,False
30245,5,25,12,"Attention, office. Who here is planning a trip to Youngstown, Ohio? I will take your silence to mean that you are all hiding something. This location is the Superior Court -",Dwight,False
30287,5,25,17,Are you all afwaid?,Michael,False
30288,5,25,17,No.,Dwight,False
30364,5,25,22,I don't need you to give me a history lesson. Ok?,Michael,False
30365,5,25,22,What do you think history is?,Dwight,False
30447,5,25,40,"Wanna dance, Dwight?",Phyllis,False
30448,5,25,40,"Ordinarily I would say no but you need to move to reduce lactic acid build-up. Also, this song is fantastic.",Dwight,False
30449,5,25,40,Mind if I steal my wife?,Bob Vance,False
30450,5,25,40,You can't steal what is legally your property.,Dwight,False
30504,5,25,51,How did I end up back in Crazytown?,Stanley,False
30505,5,25,52,It is hard to imagine you playing softball.,Dwight,False
30508,5,25,52,The girls school?,Phyllis,False
30509,5,25,53,I played high school softball. Notice I didn't say 'girls' high school softball. Not after the landmark case of Shrute vs. the Lackawanna County Board of Education.That was one case the Pennsylvania Supreme Court got right. I hit the ball right over the protest banners.,Dwight,False
30541,5,26,11,Woah. Homemade?,Rolph,False
30542,5,26,11,Of course. You think the EPA would ever allow that much DEET? [both laugh],Dwight,False
30571,5,26,16,"Bro-migo, you think you could put Erin on my row?",Andy,False
30572,5,26,16,Why? I don't understand.,Dwight,False
30611,5,26,21,So what?,Woman,False
30612,5,26,21,"Rule violation. Ball is ours. Give it to me. Our point. Okay. Hey, Pam, how ya doin? Hey, do you know if you're right-handed or left-handed? Or do you even know? What hand do you use to answer the phone?",Dwight,False
30710,5,26,33,How do you figure?,Pam,False
30711,5,26,33,"Because if we don't play, then the other team wins.",Dwight,False
30773,5,26,41,"Yeah, it looks like Pam won't make it back. Okay?",Charles,False
30774,5,26,41,Okay. Fine.,Dwight,False
30808,6,1,2,[hands Dwight a cup of water] There you go. Is there anything else I can do?,Female Intern,False
30809,6,1,2,"[chugs water, throws away cup] Yes. Umm... see those files behind Kevin's desk?",Dwight,False
30840,6,1,6,[annoyed] How do you know this?,Michael,False
30841,6,1,6,"[still typing] People tell me things. I guess I have a face you can trust. I think it's because of my low cheekbones. And... boom. [finishes typing, turns to face Michael] Okay, what is it, what can't I guess?",Dwight,False
30972,6,1,22,Why would we call you at night?,Eric,False
30973,6,1,22,"[grabs card from Eric, crumples it, throws it to the ground] Well now you can't call me at all. Problem solved.",Dwight,False
31227,6,2,18,You're into trains?,Toby,False
31228,6,2,18,I have been my whole life.,Dwight,False
31243,6,2,18,You gonna eat all that dog food yourself?,Toby,False
31244,6,2,18,Ooohhh... [crashes car into garbage cans]  Oh man!  You okay?,Dwight,False
31300,6,2,26,Why would you think a lady is me?,Darryl,False
31301,6,2,26,Are you... are you serious?  Be... cause you look exactly alike.  Am I the only one?  Are you getting this?,Dwight,False
31321,6,2,28,What?,Toby,False
31322,6,2,28,"He broke his ankle climbing over the railing and he lied about it because it was a misuse of company equipment, case closed.",Dwight,False
31357,6,2,31,"Alright, hey Michael can you pick up for one second.  [Michael picks up phone] Okay look, I'm not going to force you into anything.  If you're willing to lose Jim, fine, you just say so and we'll find another solution, okay.  Is that what you want to do?",David,False
31358,6,2,32,"Okay people,  listen up, I have an announcement to make, fraud was committed...",Dwight,False
31359,6,2,32,"Okay everybody, I have an announcement to make... whoa do you have an announcement?",Michael,False
31360,6,2,32,I'm... I was making it.,Dwight,False
31402,6,3,4,I'm sorry to hear about that. Who is this about?,Jim,False
31403,6,3,4,You!,Dwight,False
31404,6,3,4,Okay. Just want to let you know I take complaints very seriously. So... When did this happen?,Jim,False
31405,6,3,4,One minute ago.,Dwight,False
31406,6,3,4,Okay. And how do you feel?,Jim,False
31407,6,3,4,Angry.,Dwight,False
31408,6,3,4,All right. Did he hit you?,Jim,False
31409,6,3,4,No.,Dwight,False
31410,6,3,4,Did you cry?,Jim,False
31411,6,3,4,No.,Dwight,False
31412,6,3,4,Did you feel like crying?,Jim,False
31413,6,3,4,No.,Dwight,False
31617,6,3,22,Yeah. Who said that?,Meredith,False
31618,6,3,22,I think it was Creed.,Dwight,False
31706,6,4,8,What the hell?,Kevin,False
31707,6,4,8,Come on. You've got to be kidding me.,Dwight,False
31748,6,4,10,Is that all you have on her?,Michael,False
31749,6,4,10,"Well, if this is in fact her because it is a very common name.",Dwight,False
31772,6,4,15,You did?,Michael,False
31773,6,4,15,Mmm-hmm.,Dwight,False
31778,6,4,15,Are you serious? You want me to play that for a woman coming to my room?,Michael,False
31779,6,4,15,Yeah. It's practical.,Dwight,False
31824,6,4,18,I don't have a room?,Michael,False
31825,6,4,18,No you do not.,Dwight,False
31866,6,4,23,[laughs] No no. She's my girlfriend. Hey? Can you make room at the head table?,Mr. Beesly,False
31867,6,4,24,"From quarter three to quarter four up 17 percent, while his sales down two percent. It's all in the report.",Dwight,False
31868,6,4,24,Why would they make the bad man a boss if you're so much smarter?,Little Girl,False
31869,6,4,24,"Excellent question. Because while I was busy trying to improve the company and make it a success, Jim... the bad man was busy kissing the boss man's butt.",Dwight,False
31898,6,4,28,"Well, who's that one?",Michael,False
31899,6,4,28,"Isabel Poreba. Oh, I've got stuff on her. [laughs] In 1996 her tenth grade volleyball team went 10-2.",Dwight,False
31900,6,4,28,"What am I supposed to do with that, Dwight?",Michael,False
31901,6,4,28,That's a very good record.,Dwight,False
31991,6,4,41,What are you wearing?,Michael,False
31992,6,4,41,"What? It's a casual, social outfit.",Dwight,False
32001,6,4,43,Wait. You're worried about your horses? That's cool. How many horses do you have?,Isabel,False
32002,6,4,43,Nine and three-quarters.,Dwight,False
32008,6,4,45,Why?,Michael,False
32009,6,4,45,I found twins.,Dwight,False
32092,6,4,55,"That's really sweet, Dwight.  So I'll see you at the wedding?",Isabel,False
32093,6,4,55,You know it.,Dwight,False
32100,6,4,56,[watching Dwight eat breakfast] How can you eat like that?,Michael,False
32101,6,4,56,I'm ravenous after a night of love making.  You?,Dwight,False
32112,6,4,56,Wait a second.  You're not into her?  Are you kidding me?,Michael,False
32113,6,4,56,No.,Dwight,False
32114,6,4,56,She's Pam's best friend.  You guys could double date.  Swap maybe?,Michael,False
32115,6,4,56,Oh please.  Put a gun in my mouth.,Dwight,False
32159,6,4,65,Hello stranger.  How do I look?,Isabel,False
32160,6,4,65,"Oh.  Fine.  Isabel, [holds out hand] nice to see you.  What do you want?",Dwight,False
32214,6,4,73,What?,Toby,False
32215,6,4,73,I'd like to lodge a formal complaint against Jim for making us wait for over an hour.,Dwight,False
32278,6,5,7,What do you think?,Andy,False
32279,6,5,7,I think you're right. It definitely looks suspicious. And his southern Italian heritage raises some flags.,Dwight,False
32299,6,5,8,"Hey guys, I drive a SUV, does that mean I'm in the mob?",Oscar,False
32300,6,5,8,"No, not that, by itself. But look at all the facts. He seems like a mobster.",Dwight,False
32376,6,5,14,Should I change?,Andy,False
32377,6,5,14,You're wearing loafers!,Dwight,False
32481,6,5,22,"Look Mike, I don't know what your friends are telling you, but you have to decide for yourself. Are these guys gonna take care of your things if you die tomorrow?",Grotti,False
32482,6,5,22,Yes.,Dwight,False
32532,6,5,26,That we surgically remove the fear center from Michael's brain?,Andy,False
32533,6,5,26,What is wrong with you? I am talking about convincing Michael that the guy's not mafia!,Dwight,False
32567,6,5,29,No. What do you mean?,Michael,False
32568,6,5,29,"We just told you he wasn't mafia, so you wouldn't be scared.",Dwight,False
32569,6,5,29,What?,Michael,False
32570,6,5,29,You successfully backed down the mob!,Dwight,False
32603,6,6,3,"Is there someone there? Who is there? I hear voices, is somebody there?",Michael,False
32604,6,6,3,Yeah!,Dwight,False
32607,6,6,3,[gasps] It is?,Michael,False
32608,6,6,3,Yeah...,Dwight,False
32623,6,6,6,Do we have a conversation scheduled?,Jim,False
32624,6,6,6,"Number one, do not leave your things on my desk. It's not some kind of personal pen receptacle for you. I don't care how high they promote you, which brings me to item number two... I never formally congratulated you on your promotion, so I'd just like to say... [high voice, holding up wooden mallard] con-quack-ulations!",Dwight,False
32746,6,6,19,"I know, right?",Andy,False
32747,6,6,19,What were you talking about in there?,Dwight,False
32823,6,6,22,What the hell is a mallard?,Kelly,False
32824,6,6,22,That!,Dwight,False
32882,6,6,27,A wooden duck?,Jim,False
32883,6,6,27,Mallard.  I put it in your office in order to surveil you.  I was jealous that you got the promotion over me.,Dwight,False
33053,6,7,22,"And when you fell in, did you flounder?",Phyllis,False
33054,6,7,22,"Michael, flounder is both a kind of fish and -",Dwight,False
33067,6,7,24,Your nose?,Michael,False
33068,6,7,24,It's too small.,Dwight,False
33073,6,7,24,What keeps your glasses on?,Kelly,False
33074,6,7,24,"Hey! It's on the list, everybody.",Dwight,False
33229,6,8,1,Wow. H & H.  You went all the way to New York City to get us bagels?,Andy,False
33230,6,8,1,"Oh, why? Is there a place closer that sells them?",Dwight,False
33311,6,8,15,Is that right?,Andy,False
33312,6,8,15,Observe. [walks towards desk],Dwight,False
33602,6,9,3,"So let's just say that Dwight has come at you with the throat punch.  Now how would you, Dwight, defend against it?",Jim,False
33603,6,9,3,Easy.  Allow me to demonstrate.  I am attacking myself with a throat punch.  Here it comes. [gives himself a fake throat punch]  Block.  Grasp wrist as such. [grasps wrist],Dwight,False
33617,6,9,5,Yes?,Michael,False
33618,6,9,5,What is the meaning of this email that everyone got?,Dwight,False
33832,6,9,49,"We'll put down our weaponry on the count of three, you ready?",Michael,False
33833,6,9,49,"OK, I'm ready.",Dwight,False
33853,6,10,11,"Oh, is today Recyclops Day?",Stanley,False
33854,6,10,11,Yes.,Dwight,False
33964,6,10,28,"Look, do you want to be able to tell your grandkids you stood up for yourself during the - America's biggest financial crisis?",Andy,False
33965,6,10,28,How is he gonna have grandkids?,Dwight,False
33980,6,10,31,Excuse me?,Woman in line,False
33981,6,10,31,"Oh, I'm sorry. Were you raised in a household with no consequences?",Dwight,False
34194,6,11,12,"Agh, God, you know what, could this day get any worse?",Michael,False
34195,6,11,13,"Hey Jimmy, what's up?",Dwight,False
34238,6,11,17,Jim said that?,Kevin,False
34239,6,11,17,He thought you were doing an incredible job last month.,Dwight,False
34240,6,11,17,Jim said that?,Kevin,False
34241,6,11,17,You seem suprised.,Dwight,False
34252,6,11,21,Are you kidding me?,Oscar,False
34253,6,11,21,"Oh, no!",Dwight,False
34260,6,11,21,Dwight?,Jim,False
34261,6,11,21,"Yeah, you said 'In an ideal world, there would be a cash prize.'  Isn't that what you said?",Dwight,False
34287,6,11,26,"How is that possible?  No offense Pam, but how the hell is that possible?",Phyllis,False
34288,6,11,26,There must be some reasonable explanation for this.,Dwight,False
34301,6,11,29,"No, he's in his weekly staff meeting, can I take a message?",Stephanie,False
34302,6,11,29,"Tell him I'm mad at Jim, because he's asking us to give money to Pam.",Dwight,False
34335,6,11,35,"It's been crazy here.  You know I think you're doing a great job, right?",David,False
34336,6,11,35,What?,Dwight,False
34339,6,11,35,"Okay.  Hey, we still on for dinner this weekend?",David,False
34340,6,11,35,What?,Dwight,False
34365,6,11,37,How's it going?  Good day?,Ryan,False
34366,6,11,37,"Not now, Temp.",Dwight,False
34388,6,12,3,Why don't we talk more about it instead of doing it?,Meredith,False
34389,6,12,3,Thirty! Twenty-nine! Twenty-eight! [others join],Dwight,False
34390,6,12,3,Why would you start so high?,Jim,False
34391,6,12,3,Twenty- seven! Twenty-six! ...,Dwight,False
34406,6,12,3,We're supposed to applaud you for taking a giant diaper off fake tree?,Stanley,False
34407,6,12,3,This was a successful unveiling! Go back to work! Merry Christmas!,Dwight,False
34520,6,12,20,How do you know it's a gun?,Phyllis,False
34521,6,12,20,What else does it look like?,Dwight,False
34553,6,12,27,"[on karaoke microphone] Uh oh, what's Dwight gonna get? What is iiiit?",Michael,False
34554,6,12,27,Yes! [Dwight opens package to reveal another machine part],Dwight,False
34621,6,12,33,What?,Jim,False
34622,6,12,33,You are kidding me!,Dwight,False
34629,6,12,33,What?,Jim,False
34630,6,12,33,Aaaarrhh!  [kicks over Christmas tree],Dwight,False
34742,6,13,10,"What are, are you doing at my desk?",Toby,False
34743,6,13,10,Ignore him. He's the local lunatic.,Dwight,False
34881,6,14,9,"We're very excited too, aren't we guys? Right?",Michael,False
34882,6,14,9,So excited.,Dwight,False
35106,6,15,1,What?,Michael,False
35107,6,15,1,[looking through Michael's email] I'm not seeing anything under 'confirmation.',Dwight,False
35140,6,15,3,Do you always stay seated when a lady enters the room?,Jo,False
35141,6,15,3,"I am treating you the same as a man, for whom I would also not stand. Unless it was the President. Or Judge Judy.",Dwight,False
35259,6,15,26,Did you see Saw?,Ryan,False
35260,6,15,26,Of course I seesaw. Mose and I seesaw all the time.,Dwight,False
35261,6,15,26,"No, uh, the movie. Did you see the movie Saw?",Ryan,False
35262,6,15,26,"Oh, yeah. Great film. Almost as fun as going on a seesaw.",Dwight,False
35265,6,15,26,Could we lure him into an old warehouse or something?,Ryan,False
35266,6,15,26,I have an old barn!,Dwight,False
35336,6,15,35,And you guys are okay with this?,Michael,False
35337,6,15,35,"She sent an email, so.",Dwight,False
35391,6,15,43,"I would love to. [elevator doors close, then reopen in the lobby] Why not?",Ryan,False
35392,6,15,43,Because! Martini bars are pretentious. No thank you.,Dwight,False
35433,6,16,7,[as Nick looks over at her]  What are you looking at?,Angela,False
35434,6,16,7,"Ha, nerd.",Dwight,False
35437,6,16,9,Excuse me?,Angela,False
35438,6,16,9,"I want to have a child for business reasons and I want you to be the mother.  If you agree, say nothing.  If you disagree, say anything...  Very well.  Let's meet at 4:00 PM at our old meeting spot and bang it out.",Dwight,False
35486,6,16,15,What is this?,Angela,False
35487,6,16,15,"Before we conceive a child, uh, it is important that we bang out a parenting contract.",Dwight,False
35528,6,16,18,What if it's a girl?,Angela,False
35529,6,16,18,"Irrelevant question.  Section 5A, child shall be male.",Dwight,False
35641,6,16,25,"Dwight, what is the traffic like?",Michael,False
35642,6,16,25,Doesn't matter.  I'll escort you!,Dwight,False
35647,6,16,25,What!?,Michael,False
35648,6,16,25,This is where I saw that deer last week.,Dwight,False
35649,6,16,25,Where?,Michael,False
35650,6,16,25,Right over by that fence.,Dwight,False
35662,6,16,27,"I'm texting about you, okay!?",Michael,False
35663,6,16,28,"Ugh, alright.  [as he puts a police siren on top of his car]  Let's move!  ...  What?",Dwight,False
35675,6,16,29,"Guys, guys!  Stop fighting, come on.  Come on.  Do you want your kid to come out a lawyer?  Right?  Okay, you know what?  I am all over this.  Here we go.  [as he calls Dwight]  Ready?",Michael,False
35676,6,16,29,Dwight Schrute.,Dwight,False
35900,6,16,60,Have you had a chance to look over the revisions on the contract I've prepared for you?,Angela,False
35901,6,16,60,"Nothing left to do except dot the I's, the J's, and the umlauts.  Why don't you meet me here at exactly mid-late afternoon?",Dwight,False
35968,6,16,64,"[entering the Halpert house]  Hello?  Dwight?  What, what are you doing here?",Isabelle,False
35969,6,16,64,"Isabelle.  Hello...  Yeah, the uh, kitchen was disgusting, so...",Dwight,False
35972,6,16,64,All I did was bring macaroni and cheese...  Where's the fridge?,Isabelle,False
35973,6,16,64,"Oh, it's...  In the backyard.  I'll take this.",Dwight,False
36017,6,16,71,"And now you, two forms of ID, please...  Alright, all is in order.  I just need your signature...  What is it?",Angela,False
36018,6,16,71,Nothing.,Dwight,False
36019,6,16,71,Alright.  How would you like to celebrate?,Angela,False
36020,6,16,71,Just pour yourself a cup of apple juice.  I feel sick...  [Jim and Pam walk in to their house with the baby]  I couldn't find the iPod...  Give me a couple days.  I'll be out of your hair.,Dwight,False
36038,6,17,4,What do we got here?,Jim,False
36039,6,17,4,Mega-Desk.,Dwight,False
36072,6,17,12,"[swats over various photos and knickknacks, points at paperwork] Is this yours or mine?",Jim,False
36073,6,17,13,They say that no man is an island. False! I am an island and this island is volcanic. And it is about to erupt. With the molten hot lava of strategy!,Dwight,False
36084,6,17,14,Is that what happened to you?,Jim,False
36085,6,17,14,"I'll tell you what happened to me. I didn't see my father for the first two years of my life. I thought my mother was my father, and my wet-nurse was my mother.",Dwight,False
36141,6,17,21,What?,Jim,False
36142,6,17,21,My headphones are broken.,Dwight,False
36151,6,17,21,Can you grow up?,Jim,False
36152,6,17,21,"-Dad, you know we'll have a good time then.'",Dwight,False
36230,6,17,34,Sorry Sugar. What'd you want?,Jo,False
36231,6,17,34,"Well, you see, I actually do have a meeting. With a client. I'm just gonna reschedule for next week.",Dwight,False
36325,6,18,2,When are we getting to sales topics?,Stanley,False
36326,6,18,2,"Yeah, what about those leads? Did you hear anything from corporate?",Dwight,False
36331,6,18,2,Dwight?,Michael,False
36332,6,18,2,"Sorry, Michael, I got calls to make.",Dwight,False
36341,6,18,4,Is that all you have to say to me?,Michael,False
36342,6,18,4,"Yeah. You got any news on the leads? ... Okay, I'll tell you what. I'm going out on a very important sales call. You get any news about the leads, you try me. All of my numbers. All six of my numbers, okay? Including the car phone! [leaves office] Alright, Dwight out!",Dwight,False
36523,6,18,29,You think you would have done better without me? Really?,Michael,False
36524,6,18,29,I hitched my wagon to a horse with no legs.,Dwight,False
36565,6,18,33,This [picks up racquet] Why would somebody throw that out?,Michael,False
