id,season,episode,scene,line_text,speaker,deleted
46823,8,4,42,Of course I am not interested in goats. Why would you spend so much time going over the goats with me?,Robert,False
46824,8,4,42,"I can get you exotic meats  hippo steaks, giraffe burgers...",Dwight,False
46866,8,4,49,"Hey, I have a question. Who do you think is really the best salesman in this office?",Jim,False
46867,8,4,49,"That's a stupid question, obviously mISTER JAMES HALPERT!",Dwight,False
46924,8,5,12,"[Dwight walks in] Oh my god, what the hell is wrong with you?",Kelly,False
46925,8,5,12,It's called a costume.,Dwight,False
46926,8,5,12,"What are you, some kind of Jamaican zombie woman?",Kelly,False
46927,8,5,12,"Ryan, will you please tell her who I am?",Dwight,False
47007,8,5,24,"What are you, anyway?",Bert,False
47008,8,5,24,"I'm a Jamaican zombie woman, leave me alone, ghoul.",Dwight,False
47045,8,5,27,Mmhmm.  Dwight are you eating a stick?,Pam,False
47046,8,5,27,Its a root you idiot.,Dwight,False
47049,8,5,27,What do you like?  Tornadoes?,Bert,False
47050,8,5,27,Try influenza.,Dwight,False
47051,8,5,27,Oh yeah?  Whats the vaccine you can take to avoid a hurricane?,Bert,False
47052,8,5,27,Open up a newspaper.  Oh look a hurricanes coming.  I suppose youre going to tell me the scariest animal is a shark?,Dwight,False
47067,8,5,32,[to Dwight] Are you serious?,Jim,False
47068,8,5,32,Yeah Im serious.,Dwight,False
47118,8,5,41,Dwight?,Darryl,False
47119,8,5,41,"You wanna attack or let them come to us? Your call, B.",Dwight,False
47171,8,5,51,What are you anyway?,Bert,False
47172,8,5,51,"I'm a Jamaican zombie woman. Leave me alone, ghoul.",Dwight,False
47175,8,5,51,Who's your favorite character?,Bert,False
47176,8,5,51,The city of Atlanta.,Dwight,False
47207,8,6,8,[to dwight] Did you need something from us?,Robert,False
47208,8,6,8,WhaYes. Your attention. Uh because No that is all. [walks out],Dwight,False
47235,8,6,13,What do you got?,Andy,False
47236,8,6,13,"[opens folder] Allow me. You're going to love this. [struggles opening folder] Ughshould've used a shorter string. Never mind, I know it by heart. It is a system that holds people accountable for everyone else's work.",Dwight,False
47266,8,6,15,What emails are you talking about?,Kelly,False
47267,8,6,15,"Robert's favorite songs: Creep by TLC, Creep by Radio Head. You remember that one Jim? There is no way he hasn't strangled at least one stripper. Oscar. He eats his yogurt like he is punishing it for disappointing him. Kelly.",Dwight,False
47270,8,6,15,"Wait, so you installed a doomsday device?",Jim,False
47271,8,6,15,"No, it's an accountability booster.",Dwight,False
47313,8,6,26,If this bad idea goes off and we all lose our jobs. Are you going to feel good about that?,Jim,False
47314,8,6,26,I haven't even considered it. That's how sure I am that this accountability booster is going to work.,Dwight,False
47354,8,6,29,"You're a real crumb bum, you know that?",Erin,False
47355,8,6,29,"Hey, you can't just change the rules because you don't like the outcome. What about you, Kevin? What about you and your fake task? Can you tell me now where paper comes from?",Dwight,False
47379,8,6,31,What are you doing?,Pam,False
47380,8,6,31,What does it look like I'm doing? Digging a grave for a horse.,Dwight,False
47394,8,6,33,[to Dwight] Where you going?,Andy,False
47395,8,6,33,In. I'm hungry.,Dwight,False
47421,8,6,38,"Oh, haha. Oh well. Pobody's nerfect, right?",Pam,False
47422,8,6,38,"Did you just have a stroke, Pam? It's 'Nobody's perfect.' Nice stroke, Pam.",Dwight,False
47504,8,6,52,Yeah?,Andy,False
47505,8,6,52,"Maybe I could sit in on this one with you? You know, that way I can cover you in case you need to urinate or you just want another opinion, or defecate...",Dwight,False
47640,8,7,12,"Yes, because she's hot, right?",Pam,False
47641,8,7,12,"Her breasts are large, her waist is small, her reproductive health in ample evidence. And facial symmetry- come on.",Dwight,False
47643,8,7,14,"Dwight, am I hot right now?",Pam,False
47644,8,7,14,"Why would I or anyone else think that you're hot right now? I can't impregnate you, and that's the driving force between male-female attraction.",Dwight,False
47645,8,7,14,What about before? Was I attractive before?,Pam,False
47646,8,7,14,"Meh... you were at your most attractive when you were 24 with a slight, gradual decline and a steep drop-off when you got pregnant for the first time. Gradual recovery and, uh, well now, obviously, you're at an all-time low.",Dwight,False
47712,8,7,21,With the crotch?,Pam and Kelly,False
47713,8,7,21,With the crotch.,Dwight,False
47716,8,7,23,Who said that?,Creed,False
47717,8,7,23,Exactly.,Dwight,False
47718,8,7,23,How'd I get this long triangle?,Creed,False
47719,8,7,23,"Okay, just shut it.",Dwight,False
47720,8,7,23,Is he puffing out his chest?,Pam,False
47721,8,7,23,I can't tell. It's unnaturally sunken. [Jim says something and Cathy laughs] Busted. He just was mirroring. Did you see that?,Dwight,False
47726,8,7,23,Why's he making her laugh so much?,Pam,False
47727,8,7,23,"Just going to walk over here- [fake trips] whoa, whoa, I'm slipping and falling! Oh, stumbling, I need something to grab on to! [grabs Jim's crotch]",Dwight,False
47729,8,7,23,Are you okay?,Cathy,False
47730,8,7,23,"I'm fine, I'm totally fine.",Dwight,False
47735,8,7,23,Dwight! [pushes Dwight's hands away] Why?,Jim,False
47736,8,7,23,"I'm sorry, I fell down, Mr. Balance.",Dwight,False
47773,8,7,30,"Uh, are you all in line?",Old Man,False
47774,8,7,30,"Why don't you go check out the sympathy cards, old man? [to Jim] Now I'm going to ask you just a few simple questions. Wait for this to constrict. Here we go. Is your name Jim Halpert?",Dwight,False
47776,8,7,30,"Wait, that's it? That's the question you're going to ask him?",Pam,False
47777,8,7,30,We have to start with a baseline question to establish what the truth is.,Dwight,False
47804,8,7,35,"Pam, are you really gonna listen to his stupid homemade test?",Jim,False
47805,8,7,35,"I would listen to my homemade test, because your husband is definitely lying. In fact, he's lied about every question. Even his name. Who are you really?",Dwight,False
47806,8,7,35,"Wait, what?",Pam,False
47807,8,7,35,"Look at the numbers. Every single time, it's come up 150 over 100. Your husband is a pathological liar.",Dwight,False
47935,8,8,17,"Dwight, what are you telling this girl?",Oscar,False
47936,8,8,17,The truth.,Dwight,False
47942,8,8,17,"Really? Why don't you tell us the real history, Gore Vidal?",Oscar,False
47943,8,8,17,"Okay, I will. I don't know who that is, but I'm gonna tell you this-",Dwight,False
47953,8,8,17,What?,Oscar,False
47954,8,8,17,Sure! I will cede it was the second-most northernmost battle!,Dwight,False
48029,8,8,31,Youve heard about it?,Oscar,False
48030,8,8,31,YES!  Ha!  Prepare to be refuted!  Go on.,Dwight,False
48096,8,8,44,"That's weird, if it's not locked, why isn't it opening?",Jim,False
48097,8,8,44,"It's, it's latched closed.",Dwight,False
48118,8,9,3,"Hey guys lets just all admit it. Ok? Dwights better than us. He had the guts to stop sitting. And hes never, ever going to go back on it right?",Jim,False
48119,8,9,3,Thats right Jim.,Dwight,False
48122,8,9,4,Taking a load off huh?,Darryl,False
48123,8,9,4,No. Putting a load on more like it.,Dwight,False
48131,8,9,5,You know what its not my best. Because you could just easily bend over and pick it up right?,Jim,False
48132,8,9,5,"I could, but I just dont feel like it loser.",Dwight,False
48133,8,9,5,Because youre sitting?,Jim,False
48134,8,9,5,Standing.,Dwight,False
48137,8,9,5,Because youre sitting?,Jim,False
48138,8,9,5,Standing.,Dwight,False
48378,8,9,36,Hmm?,Andy,False
48379,8,9,37,"You're nothing! You're so weak, you call yourself a man? Huh?",Dwight,False
48394,8,9,41,"Um, where's the shower?",Erin,False
48395,8,9,41,There is no shower.,Dwight,False
48396,8,9,41,There isn't?,Kathy,False
48397,8,9,41,"What does this look like, a shower store? Get lost.",Dwight,False
48466,8,10,8,What was that?,Jim,False
48467,8,10,8,What is it?,Dwight,False
48552,8,10,22,"I wonder, in this office, who has access to a porcupine?",Jim,False
48553,8,10,22,Or who in this office knows that I have access and is trying to set me up?,Dwight,False
48573,8,10,24,"[on phone]Uh, I don't know, let me ask. [to Dwight] Uh, were you quilled?",Jim,False
48574,8,10,24,"Yes, I was quilled.",Dwight,False
48575,8,10,24,And what's it's name?,Jim,False
48576,8,10,24,Henrietta.,Dwight,False
48787,8,11,5,"Oh, hello Mr. Schrute. I'll tell him you're here. Can I get you anything at all?",Receptionist,False
48788,8,11,5,I'm not here to be given anything. I'm here to take what is mine.,Dwight,False
48790,8,11,5,Dwight? What are you doing here?,Gabe,False
48791,8,11,5,Gabe? You don't know?,Dwight,False
48836,8,11,10,Yeah. But not just bagels. All unwanted problems. Question: What's the most important appliance in your house?,Gabe,False
48837,8,11,10,Meat grinder.,Dwight,False
48907,8,11,15,What?,Gabe,False
48908,8,11,15,What's with the smile?,Dwight,False
48969,8,11,21,"They haven't really improved on the Oreo, have they?",Robert,False
48970,8,11,21,No thank you.,Dwight,False
48973,8,11,21,You were dining alone? All those people are you?,Robert,False
48974,8,11,21,"Yes, exactly. Riddle number two: Who is going-",Dwight,False
48975,8,11,21,"Ah-ah-ah- your drive, your ambition. It would be wasted on a manager's job. And Florida, you don't want to live here. Even I don't want to live here. That's why I'm always at my place in Scranton. Florida is America's basement: It's wet, it's filled with mold, strange insects, alligators. Alligators are dinosaurs, Dwight. You know that, right?",Robert,False
48976,8,11,21,N... it's complicated.,Dwight,False
49037,8,12,3,Are you ready for some meatball?,Stanley,False
49038,8,12,3,"Aw, man. [Stanley laughs] This is not very clever, Jim.",Dwight,False
49042,8,12,4,[to Phyllis] Oh okay. Good night. [climbs in to Dwight's car] What's the haul?,Stanley,False
49043,8,12,4,Thirty-two meatballs.,Dwight,False
49053,8,12,10,"Oh, who needs a house that size?",Oscar,False
49054,8,12,10,Big. Stupid. Pure chump bait.,Dwight,False
49130,8,12,18,What you doing?,Erin,False
49131,8,12,18,I'm relaxing. Scram. [pushes her],Dwight,False
49136,8,12,18,"Come on, don't you want to play?",Erin,False
49137,8,12,18,Oh really?,Dwight,False
49193,8,12,26,What is the most romantic possible thing?,Erin,False
49194,8,12,26,We can get some chicken fights going in the pool.,Dwight,False
49201,8,12,26,Dang it! What the heck already?,Erin,False
49202,8,12,26,"Hey, Cathy. Chicken fight!",Dwight,False
49324,8,12,42,"You date a guy, you find out he was engaged to your coworker so you throw cake at him. It's over. You start liking him again so you ask him out with a puppet show. He says no. Then he follows you home to make sure that you don't kiss somebody. Then he ignores you at a pool party? Am I right ladies?",Erin,False
49325,8,12,43,"[Erin helps Dwight stretch his inner thighs] Yeah. Oh, yeah. Oooooh, yeah.",Dwight,False
49433,8,13,12,"What's up, gangstas?",Andy,False
49434,8,13,12,Jim was lying about jury duty. He was lying the whole time so he could go do yoga or go canoeing. I don't know what this pervert likes. Fire him!,Dwight,False
49456,8,13,15,[pulls food truck up to where Dwight and Nate are standing] Where you want I park?,Ernesto,False
49457,8,13,16,"Okay, everybody, gather 'round. Got a real special surprise for you. [indicates Ernesto and assistant who are carrying empanadas]",Dwight,False
49509,8,13,20,Funny? No? Nobody laughing?,Jim,False
49510,8,13,20,"[laughs] You're screwed! Oh, it's happening. It's really happening.",Dwight,False
49543,8,13,24,Don't you want to see the baby?,Oscar,False
49544,8,13,24,Psh! Why? I know what Angela and the senator look like. I can mash that up in my head right now.,Dwight,False
49639,8,13,31,All done?,Senator Lipton,False
49640,8,13,31,Yeah.,Dwight,False
49646,8,13,32,Who are you?,Nurse,False
49647,8,13,32,I just might be his father.,Dwight,False
49674,8,13,36,You had something important to tell me?,Gabe,False
49675,8,13,36,"Oh, you know, I did but now it seems infinitely insignificant.",Dwight,False
49773,8,14,8,Really?,Pam,False
49774,8,14,8,Mm hm.,Dwight,False
49778,8,14,8,Does this have anything to do with what you were talking to Andy about?,Pam,False
49779,8,14,8,"God, you're such a spy.",Dwight,False
49808,8,14,12,"You wanna take Darryl, Phyllis, Toby, Angela and Oscar?",Andy,False
49809,8,14,12,Yes.,Dwight,False
49810,8,14,12,Can I interest you in someone less essential? Like uh a Creed or a Meredith perhaps?,Andy,False
49811,8,14,12,Oh my god.,Dwight,False
49837,8,14,16,Why?,Kelly,False
49838,8,14,16,"Oh, no big deal. It's just that you five have been deemed most deserving of a three week all expenses paid business trip to Tallahassee, Florida.",Dwight,False
49849,8,14,16,What are the criteria for going?,Ryan,False
49850,8,14,16,"It might be innate goodness versus innate badness? But there's an easy way to find out. [knocks on Andy's office door] Oh Andy, gotta few questions for you.",Dwight,False
49876,8,14,18,Five to six hours?,Andy,False
49877,8,14,18,Three to four hours.,Dwight,False
49952,8,14,29,Why is it so hot in here?,Stanley,False
49953,8,14,29,"Hot? What are you talking about? This is a nice temperate Florida morning. Eighty-five degrees, seventy-five percent humidity. This is the exact environment you will be facing for the next three weeks of your life. Welcome to special projects orientation. The next three weeks of your life are gonna be the most miserable you've ever faced. They're gonna be hard, they're gonna be dirty. You're gonna wish you were dead.",Dwight,False
49958,8,14,29,Is that the buzzer from Taboo?,Jim,False
49959,8,14,29,"SHUT UP MAGGOT! YOU DON'T WANT TO GO, RING THE BELL! RING IT! Ring it.",Dwight,False
49961,8,14,30,How did a mosquito get in here?,Stanley,False
49962,8,14,31,"I released three hundred mosquitoes in the conference room, just temporarily. When I'm done, the frogs will take care of the mosquitoes. [Frog in plastic cage ribbits]",Dwight,False
49985,8,14,37,"So, what is this special project?",Jim,False
49986,8,14,37,Basically Sabre has tasked us with helping them branch into the retail marketplace. They want to set up their own version of an Apple store.,Dwight,False
49992,8,14,37,It seems to me that the Apple store is kind of like a party. So I think our question is: How do we make this a better party?,Ryan,False
49993,8,14,37,No. We sell business tools and the stores need to reflect that. They need to be all business. Let all the other stores look like a toy store.,Dwight,False
49995,8,14,37,"Dwight, is now a good time to go over what you expect of us?",Jim,False
49996,8,14,37,[long pause] Yes. What are my expectations for the group?,Dwight,False
50009,8,14,41,"[On phone] All expenses paid. Yeah, Jim's gonna be there. Their marriage is not good. Nobody knows better than me. Definitely we will. It's three weeks in Tallahassee, what else is there to do?",Kathy,False
50010,8,15,1,"Today is the first day of Sabre's new project to develop a chain of retail stores. I am meeting my new boss, Nellie Bertram, head of special projects. Work starts at nine. Sabre HQ is thirty minutes away, driving the speed limit. Giving everyone twenty minutes to shower, plus fifty for Jim to style his hair, twenty for breakfast, forty for Erin to get lost between her room and the lobby, ninety for Ryan to do his morning ecstasy... We're already twenty minutes late.",Dwight,False
50022,8,15,6,What do you think happened?,Erin,False
50023,8,15,6,"Looks like Jim got mixed up with some bad apples. [sees 'IT WAS DWIGHT' written in lipstick on the door] Oh no, no, no, no. It wasn't me. I gotta find Luwanda at The Alcohol Club. Oh. [Jim falls out of the closet, Erin and Dwight scream]",Dwight,False
50030,8,15,9,What does he like?,Saleswoman,False
50031,8,15,9,Power.,Dwight,False
50034,8,15,10,"Hey, are you okay?",Erin,False
50035,8,15,10,"I'm fine, okay? It's just stress. You know, 'cause I care about this project. And frankly the fact that none of you are vomiting or diarrheal right now I find very alarming.",Dwight,False
50039,8,15,10,"Oh no, I'm serious. I was thinking, 'For this trip I have to do something epic, so what should that be?' and then I thought of it. I'll poison you. What are you gonna do? You gonna steal my newspaper or put a cricket in my cereal or something?",Jim,False
50040,8,15,10,I'm gonna set your face on fire.,Dwight,False
50079,8,15,13,Still queer?,Packer,False
50080,8,15,13,Packer.,Dwight,False
50112,8,15,16,"Sir? Sir, where should we send the ambulance?",Emergency Operator,False
50113,8,15,16,"Send it to the frickin' moon, idiot.",Dwight,False
50120,8,15,17,Why are you sitting down like that?,Nellie,False
50121,8,15,17,"Why is everyone else standing up? Okay team, let's get back to work! Break's over!",Dwight,False
50142,8,15,20,"Dwight, why don't we just hold off with the human pyramids for a while?",Jim,False
50143,8,15,20,"Everyone stop moving! Everyone stop wiggling! Oh, I feel like I'm gonna vomit!",Dwight,False
50157,8,15,22,"Drama queen, am I right?",Packer,False
50158,8,15,22,"[to phone] Phillip, if you're hearing this memo, that can only mean one thing, I'm dead. You are the rightful heir to Schrute Farms. Please, you must do one thing. Kill Mose before he kills you. [presses button] Mose, hey, it's Dwight. Listen, yeah, I just want to give you a heads-up.",Dwight,False
50179,8,15,25,"Dwight, are you all right?",Nellie,False
50180,8,15,25,I'm great. How are you?,Dwight,False
50195,8,15,28,"Ah, what is your topic?",Nellie,False
50196,8,15,28,"What is our topic? Oh, what a topic it is.",Dwight,False
50203,8,15,30,Are those the lyrics?,Kevin,False
50204,8,15,31,Anderson's three pillars of retail. Crucial. So important. Next. Are there any questions?,Dwight,False
50225,8,15,33,How are you feeling?,Nellie,False
50226,8,15,33,"Amazing. Just lost four ounces of appendix, already replaced it with muscle.",Dwight,False
50227,8,15,33,Can I see the wound?,Nellie,False
50228,8,15,33,[show her the wound] Oh God.,Dwight,False
50319,8,16,15,What happens if you're the hunchback?,Gabe,False
50320,8,16,15,"Oh, you get kicked.",Dwight,False
50321,8,16,15,How many buttons do you have?,Jim,False
50322,8,16,15,(takes out bag) 40. Always.,Dwight,False
50323,8,16,15,Can I see?,Cathy,False
50324,8,16,15,Sure. (Hands bag to Cathy),Dwight,False
50460,8,16,30,What's in it for GSL?,Gabe,False
50461,8,16,30,You really want Packer as your boss?,Dwight,False
50490,8,16,32,"Alright, then I will catch you later What do we do now?",Jim,False
50491,8,16,32,We wait. [Shower starts] Come to papa.,Dwight,False
50503,8,16,33,Is that really how you want to get this job?,Jim,False
50504,8,16,33,Such a chorus girl.,Dwight,False
50591,8,16,41,[whispers] Is that Nellie?,Jim,False
50592,8,16,41,[whispers] Don't let-shh!,Dwight,False
50595,8,17,1,Are you holding this chair?,Ryan,False
50596,8,17,1,Yes.,Dwight,False
50603,8,17,3,"Test launch day, people. Now, I would like to fill you in on a little secret about me to inspire you today. Now, I know you probably all think Im this patrician goddess. But heres the truth. I was born in the little working class town of Basildon, and until the age of 32, [cockney accent] I talked like this, which was bloody horrendous, innit? I came from dirt, no lower than  whats lower than dirt?",Nellie,False
50604,8,17,3,"Loam, magma, mantle, outer core, inner core.",Dwight,False
50692,8,17,13,"Im really sorry. Is there anything I can do, maybe pretend to be Chuck?",Jim,False
50693,8,17,13,"You could have pretended to be Chuck. I begged you to pretend to be Chuck, but you chose to be yourself, and you can no longer be Chuck! Surrender the tripack. You know what you have to do.",Dwight,False
50723,8,17,19,"Yeah, no [bleep], Sherlock! Can somebody please tell me something encouraging about this presentation before I go out there in front of a million people and do it?",Ryan,False
50724,8,17,19,"Okay. I know, I know, champ. Calm down, just listen.",Dwight,False
50725,8,17,19,You know what?,Ryan,False
50726,8,17,19,You just need to realize that so much rides on this. You have no idea.,Dwight,False
50771,8,17,21,Whens the presentation?,Blogger,False
50772,8,17,21,Its moments away. Just stay here!,Dwight,False
50788,8,17,24,"Oops, thats my phone. Am I allowed to answer it or are you gonna freak out?",Jim,False
50789,8,17,24,Are there any bloggers around?,Dwight,False
50791,8,17,24,What is the delay here? Wheres Ryan? Why is he not here?,Nellie,False
50792,8,17,24,"I had to send him home. As brilliant and creative as he is, he is nothing... compared to this guy!",Dwight,False
50794,8,17,24,What?,Nellie,False
50795,8,17,24,Thats right. Will you just give us a second?,Dwight,False
50804,8,17,24,A costume?,Jim,False
50805,8,17,24,"Of course theres a costume! [laughs] Oh, this is gonna be great. Theres nothing like some last-minutes changes to really energize a presentation.",Dwight,False
50954,8,18,19,Can I just talk to you for one quick second?,Jim,False
50955,8,18,19,"What, your stylist ran out of 'messy spray'? [others laugh]",Dwight,False
50958,8,18,19,"Nice. [To Jim] Hey, Halpert, anyone ever tell you you look like Wooly Willy?",Todd Packer,False
50959,8,18,19,[to Packer] Silence.,Dwight,False
51022,8,18,28,"OK, great, listen to me. Listen to me. [Dwight makes funny gesture] No, no, I know. Will you just let me tell you one thing, please?",Jim,False
51023,8,18,28,"Yes, you may tell me one thing. Wait, you want to borrow money?",Dwight,False
51039,8,18,29,"Gross! Don't lick my hand! God, why is there so much saliva?",Jim,False
51040,8,18,29,AlI had to do was think about pie and my salivary glands did the rest.,Dwight,False
51043,8,18,29,"What? What, what, what, what, what?",Jim,False
51044,8,18,29,"[clutching side] Oh, god! You... oh! My appendix-",Dwight,False
51049,8,18,29,You all right? You ok?,Jim,False
51050,8,18,29,[stops whining and charges Jim] Rrrah!,Dwight,False
51066,8,18,32,What are you doing?,Jim,False
51067,8,18,32,I was trying to go-,Dwight,False
51093,8,18,36,Why?,Jim,False
51094,8,18,36,Anything else you need to talk about?,Dwight,False
51247,8,19,29,"Dwight, should she be our manager?",Jim,False
51248,8,19,29,I wouldn't let her manage a celery farm.,Dwight,False
51257,8,19,31,"Dwight, you carry this company on your massive shoulders. You are our Atlas, and for that do you not think you deserve a raise?",Nellie,False
51258,8,19,31,There's no limit to what I think I deserve.,Dwight,False
51259,8,19,31,Then you accept it?,Nellie,False
51260,8,19,31,Five percent. No less.,Dwight,False
51423,8,20,2,What does that mean?,Oscar,False
51424,8,20,2,"Okay, okay.",Dwight,False
51510,8,20,14,Whoa. Who is this guy?,Jim,False
51511,8,20,14,Here's the two of them taking a hike. I'm guessing he's some kind of friend.,Dwight,False
51514,8,20,14,Like a boyfriend?,Jim,False
51515,8,20,14,You read my mind.,Dwight,False
51649,8,20,23,What?,Magician,False
51650,8,20,23,You heard me!,Dwight,False
51715,8,21,8,What happened to old salty?,Andy,False
51716,8,21,8,Nellie let me bobble-ize him. His name is now Captain Mutato.,Dwight,False
51801,8,21,26,Did it affect you outside of the office?,Erin,False
51802,8,21,26,How?,Dwight,False
51803,8,21,26,I don't know what the technical term is... Penial softiosis?,Erin,False
51804,8,21,26,"Erin, I am so glad that you trusted me. You came to the exact right person for this. No, I have never once experienced anything remotely like that. Never.",Dwight,False
51820,8,21,31,What do you mean?,Nellie,False
51821,8,21,31,"Erin made it clear to me that he was unable to perform sexually last night. By contrast, I went to sleep with an erection so large it was like I was wearing no blanket at all. Wow, I knew you'd win, but you just demolished him! I'm a little bit jealous, actually. Reduced him to a mere ant.",Dwight,False
51842,8,21,35,Dwight couldn't get it up for Nellie?,Kevin,False
51843,8,21,35,"No, no, no, no, no, It's not me. I'm gonna prove it right here and now. [thrusts his pelvis]",Dwight,False
51878,8,21,39,"I know, right?",Gabe,False
51879,8,21,39,"You know, my rectal electro-ejaculator is rated for bovine use only but I could let you rent it.",Dwight,False
52017,8,22,4,What's going on?,Oscar,False
52018,8,22,4,There is a disgruntled ex-employee sitting in his car in the parking lot.,Dwight,False
52022,8,22,4,"How do you? I mean, why do you think he's there?",Phyllis,False
52023,8,22,4,"I don't even know what kind of weapon he has. Could be a knife, could be a gun. Could be a series of guns all lined up to shoot parallel. I'm going up to the roof. [Grabs bag.] And I'm gonna bring my gym bag just in case.",Dwight,False
52235,8,23,3,We got it?,Gabe,False
52236,8,23,4,Very funny Jim.,Dwight,False
52241,8,23,4,Okay. You dont need my help?,Jim,False
52242,8,23,4,"Here, here Just",Dwight,False
52291,8,23,10,"Jim, Dwight, what are your last names?",Erin,False
52292,8,23,10,And you are,Dwight,False
52353,8,23,20,"Hold on, hold on. Is this him?",Jim,False
52354,8,23,20,What?,Dwight,False
52355,8,23,20,Is that him?,Jim,False
52356,8,23,20,Its him! Do something! Get out!,Dwight,False
52361,8,23,20,Nos? You mean like in fast and furious?,Jim,False
52362,8,23,20,Yeah.,Dwight,False
52365,8,23,20,Are you sure?,Jim,False
52366,8,23,20,Yes.,Dwight,False
52400,8,23,28,You all right?,Jim,False
52401,8,23,28,"Yeah. [Doors about to close, hand stops them] Oh.",Dwight,False
52403,8,23,28,"[Dwight pushes button for floor two] Dwight, what are you doing?",Jim,False
52404,8,23,28,"Go, go! Take the stairs! Now!",Dwight,False
52405,8,23,28,What are you talking about?,Jim,False
52406,8,23,28,Just run! Take the stairs!,Dwight,False
52410,8,23,28,[Dwight jumping] What are you doing?,Harry,False
